,no,label,title,href
0,17.501,Conseil national - 05.06.2019-08:00 - Initiative parlementaire - Reynard Mathias,Harcèlement sexuel. Alléger le fardeau de la preuve,https://www.parlament.ch/fr/ratsbetrieb/amtliches-bulletin/amtliches-bulletin-die-verhandlungen?SubjectId=46184
1,18.078,Conseil national - 04.06.2019-08:00 - Objet du Conseil fédéral,Programme de développement stratégique de l’infrastructure ferroviaire. Etape d’aménagement 2035,https://www.parlament.ch/fr/ratsbetrieb/amtliches-bulletin/amtliches-bulletin-die-verhandlungen?SubjectId=46137
2,18.074,Conseil national - 22.03.2019-08:00 - Objet du Conseil fédéral,Environnement mondial 2019-2022. Crédit-cadre,https://www.parlament.ch/fr/ratsbetrieb/amtliches-bulletin/amtliches-bulletin-die-verhandlungen?SubjectId=45845
3,18.3404,Conseil national - 21.03.2019-15:00 - Motion - Häberli-Koller Brigitte,Transformer la station de recherche Agroscope en établissement autonome de droit public de la Confédération doté de la personnalité juridique,https://www.parlament.ch/fr/ratsbetrieb/amtliches-bulletin/amtliches-bulletin-die-verhandlungen?SubjectId=45831
4,18.3717,Conseil national - 21.03.2019-15:00 - Initiative cantonale;Motion - Commission de politique extérieure-Conseil des Etats,Aucune concession en ce qui concerne l'huile de palme,https://www.parlament.ch/fr/ratsbetrieb/amtliches-bulletin/amtliches-bulletin-die-verhandlungen?SubjectId=45829
5,18.049,Conseil national - 20.03.2019-15:00 - Objet du Conseil fédéral,Loi sur les services d‘identification électronique,https://www.parlament.ch/fr/ratsbetrieb/amtliches-bulletin/amtliches-bulletin-die-verhandlungen?SubjectId=45808
6,18.4048,Conseil national - 19.03.2019-08:00 - Postulat - Reynard Mathias,Il est temps d'obtenir des chiffres fiables sur la problématique du harcèlement sexuel,https://www.parlament.ch/fr/ratsbetrieb/amtliches-bulletin/amtliches-bulletin-die-verhandlungen?SubjectId=45756
7,18.066,Conseil national - 11.03.2019-14:30 - Objet du Conseil fédéral,"Routes nationales sur la période 2020-2023, étape d'aménagement 2019 des routes nationales et crédit d'engagement. Plafond de dépenses",https://www.parlament.ch/fr/ratsbetrieb/amtliches-bulletin/amtliches-bulletin-die-verhandlungen?SubjectId=45529
8,18.054,Conseil national - 13.12.2018-08:00 - Objet du Conseil fédéral,Message 2018 sur les immeubles du DFF,https://www.parlament.ch/fr/ratsbetrieb/amtliches-bulletin/amtliches-bulletin-die-verhandlungen?SubjectId=45013
9,18.041,Conseil national - 13.12.2018-08:00 - Objet du Conseil fédéral,Budget 2019 assorti du plan intégré des tâches et des finances 2020-2022,https://www.parlament.ch/fr/ratsbetrieb/amtliches-bulletin/amtliches-bulletin-die-verhandlungen?SubjectId=45005
10,18.035,Conseil national - 12.12.2018-08:15 - Objet du Conseil fédéral,Davantage de logements abordables. Initiative populaire et crédit-cadre destiné à alimenter le fonds de roulement,https://www.parlament.ch/fr/ratsbetrieb/amtliches-bulletin/amtliches-bulletin-die-verhandlungen?SubjectId=44977
11,18.041,Conseil national - 11.12.2018-08:00 - Objet du Conseil fédéral,Budget 2019 assorti du plan intégré des tâches et des finances 2020-2022,https://www.parlament.ch/fr/ratsbetrieb/amtliches-bulletin/amtliches-bulletin-die-verhandlungen?SubjectId=44959
12,18.041,Conseil national - 06.12.2018-08:00 - Objet du Conseil fédéral,Budget 2019 assorti du plan intégré des tâches et des finances 2020-2022,https://www.parlament.ch/fr/ratsbetrieb/amtliches-bulletin/amtliches-bulletin-die-verhandlungen?SubjectId=44866
13,18.041,Conseil national - 29.11.2018-08:00 - Objet du Conseil fédéral,Budget 2019 assorti du plan intégré des tâches et des finances 2020-2022,https://www.parlament.ch/fr/ratsbetrieb/amtliches-bulletin/amtliches-bulletin-die-verhandlungen?SubjectId=44747
14,18.041,Conseil national - 28.11.2018-08:00 - Objet du Conseil fédéral,Budget 2019 assorti du plan intégré des tâches et des finances 2020-2022,https://www.parlament.ch/fr/ratsbetrieb/amtliches-bulletin/amtliches-bulletin-die-verhandlungen?SubjectId=44728
15,18.041,Conseil national - 27.11.2018-08:00 - Objet du Conseil fédéral,Budget 2019 assorti du plan intégré des tâches et des finances 2020-2022,https://www.parlament.ch/fr/ratsbetrieb/amtliches-bulletin/amtliches-bulletin-die-verhandlungen?SubjectId=44723
16,18.041,Conseil national - 27.11.2018-08:00 - Objet du Conseil fédéral,Budget 2019 assorti du plan intégré des tâches et des finances 2020-2022,https://www.parlament.ch/fr/ratsbetrieb/amtliches-bulletin/amtliches-bulletin-die-verhandlungen?SubjectId=44716
17,18.3390,"Conseil national - 26.09.2018-08:30 - Motion - Commission de la science, de l'éducation et de la culture-Conseil national",Suspension de la réorganisation d'Agroscope,https://www.parlament.ch/fr/ratsbetrieb/amtliches-bulletin/amtliches-bulletin-die-verhandlungen?SubjectId=44394
18,18.022,Conseil national - 13.09.2018-08:00 - Objet du Conseil fédéral,Message sur I'armée 2018,https://www.parlament.ch/fr/ratsbetrieb/amtliches-bulletin/amtliches-bulletin-die-verhandlungen?SubjectId=43946
19,18.031,Conseil national - 12.09.2018-08:00 - Objet du Conseil fédéral,Projet fiscal 17,https://www.parlament.ch/fr/ratsbetrieb/amtliches-bulletin/amtliches-bulletin-die-verhandlungen?SubjectId=43933
20,17.063,Conseil national - 07.06.2018-08:00 - Objet du Conseil fédéral,Stopper le mitage - pour un développement durable du milieu bâti (initiative contre le mitage). Initiative populaire,https://www.parlament.ch/fr/ratsbetrieb/amtliches-bulletin/amtliches-bulletin-die-verhandlungen?SubjectId=43441
21,18.005,Conseil national - 07.06.2018-08:00 - Objet du Parlement,Haute surveillance sur la construction de la NLFA en 2017,https://www.parlament.ch/fr/ratsbetrieb/amtliches-bulletin/amtliches-bulletin-die-verhandlungen?SubjectId=43439
22,17.024,Conseil national - 04.06.2018-14:30 - Objet du Conseil fédéral,Pour la dignité des animaux de rente agricoles (Initiative pour les vaches à cornes). Initiative populaire,https://www.parlament.ch/fr/ratsbetrieb/amtliches-bulletin/amtliches-bulletin-die-verhandlungen?SubjectId=43310
23,18.003,Conseil national - 31.05.2018-08:00 - Objet du Conseil fédéral,Compte d'Etat 2017,https://www.parlament.ch/fr/ratsbetrieb/amtliches-bulletin/amtliches-bulletin-die-verhandlungen?SubjectId=43261
24,16.3332,Conseil national - 28.02.2018-15:00 - Motion - Grin Jean-Pierre,"Négociations avec la Malaisie, sans l'huile de palme!",https://www.parlament.ch/fr/ratsbetrieb/amtliches-bulletin/amtliches-bulletin-die-verhandlungen?SubjectId=42443
25,17.3916,Conseil national - 28.02.2018-08:00 - Postulat - Jans Beat,Faciliter la reprise des terres et des exploitations agricoles,https://www.parlament.ch/fr/ratsbetrieb/amtliches-bulletin/amtliches-bulletin-die-verhandlungen?SubjectId=42429
26,17.3358,"Conseil national - 27.02.2018-08:00 - Initiative cantonale;Motion - Commission de l'environnement, de l'aménagement du territoire et de l'énergie-Conseil des Etats",Réaffectation de bâtiments agricoles inutilisés à des fins d'habitation,https://www.parlament.ch/fr/ratsbetrieb/amtliches-bulletin/amtliches-bulletin-die-verhandlungen?SubjectId=42387
27,17.041,Conseil national - 07.12.2017-08:00 - Objet du Conseil fédéral,Budget 2018 assorti du plan intégré des tâches et des finances 2019-2021,https://www.parlament.ch/fr/ratsbetrieb/amtliches-bulletin/amtliches-bulletin-die-verhandlungen?SubjectId=41808
28,17.023,Conseil national - 05.12.2017-08:00 - Objet du Conseil fédéral,Pour la souveraineté alimentaire. L’agriculture nous concerne toutes et tous. Initiative populaire,https://www.parlament.ch/fr/ratsbetrieb/amtliches-bulletin/amtliches-bulletin-die-verhandlungen?SubjectId=41784
29,17.041,Conseil national - 30.11.2017-08:00 - Objet du Conseil fédéral,Budget 2018 assorti du plan intégré des tâches et des finances 2019-2021,https://www.parlament.ch/fr/ratsbetrieb/amtliches-bulletin/amtliches-bulletin-die-verhandlungen?SubjectId=41673
30,17.3362,Conseil national - 27.09.2017-08:15 - Motion - Commission des finances-Conseil national,Fixation du montant du financement de l'aide publique au développement,https://www.parlament.ch/fr/ratsbetrieb/amtliches-bulletin/amtliches-bulletin-die-verhandlungen?SubjectId=41179
31,16.073,Conseil national - 26.09.2017-08:00 - Objet du Conseil fédéral,Pour des denrées alimentaires saines et produites dans des conditions équitables et écologiques (initiative pour des aliments équitables). Initiative populaire,https://www.parlament.ch/fr/ratsbetrieb/amtliches-bulletin/amtliches-bulletin-die-verhandlungen?SubjectId=41077
32,17.030,Conseil national - 19.09.2017-08:00 - Objet du Conseil fédéral,Sortons de l'impasse! Renonçons à rétablir des contingents d'immigration. Initiative populaire,https://www.parlament.ch/fr/ratsbetrieb/amtliches-bulletin/amtliches-bulletin-die-verhandlungen?SubjectId=40984
33,17.3259,Conseil national - 14.06.2017-15:00 - Motion - Commission des finances-Conseil national,Réduire les dépenses liées,https://www.parlament.ch/fr/ratsbetrieb/amtliches-bulletin/amtliches-bulletin-die-verhandlungen?SubjectId=40552
34,16.031,Conseil national - 14.06.2017-08:15 - Objet du Conseil fédéral,Imposition des immeubles agricoles et sylvicoles. Loi,https://www.parlament.ch/fr/ratsbetrieb/amtliches-bulletin/amtliches-bulletin-die-verhandlungen?SubjectId=40546
35,17.3127,Conseil national - 14.06.2017-08:15 - Motion - Hausammann Markus,Poursuivre l'aide alimentaire en produits laitiers pour lutter contre la faim dans le monde,https://www.parlament.ch/fr/ratsbetrieb/amtliches-bulletin/amtliches-bulletin-die-verhandlungen?SubjectId=40527
36,17.027,Conseil national - 08.06.2017-08:00 - Objet du Conseil fédéral,Message sur l’armée 2017,https://www.parlament.ch/fr/ratsbetrieb/amtliches-bulletin/amtliches-bulletin-die-verhandlungen?SubjectId=40386
37,17.3272,"Conseil national - 07.06.2017-08:00 - Motion - Commission de la science, de l'éducation et de la culture-Conseil national",Eviter le gaspillage alimentaire par une régulation moindre,https://www.parlament.ch/fr/ratsbetrieb/amtliches-bulletin/amtliches-bulletin-die-verhandlungen?SubjectId=40350
38,16.427,"Conseil national - 06.06.2017-14:30 - Initiative parlementaire - Commission de la science, de l'éducation et de la culture-Conseil national",Assurer un déroulement efficace des débats parlementaires en adaptant la révision de la loi sur le Parlement,https://www.parlament.ch/fr/ratsbetrieb/amtliches-bulletin/amtliches-bulletin-die-verhandlungen?SubjectId=40311
39,17.003,Conseil national - 31.05.2017-08:00 - Objet du Conseil fédéral,Compte d'Etat 2016,https://www.parlament.ch/fr/ratsbetrieb/amtliches-bulletin/amtliches-bulletin-die-verhandlungen?SubjectId=40192
40,15.3944,Conseil national - 04.05.2017-15:00 - Motion - Grin Jean-Pierre,Fiscalité agricole. Mise en oeuvre de la motion Müller Leo 12.3172,https://www.parlament.ch/fr/ratsbetrieb/amtliches-bulletin/amtliches-bulletin-die-verhandlungen?SubjectId=40131
41,16.3705,Conseil national - 04.05.2017-08:00 - Motion - Dittli Josef,Compenser le renchérissement uniquement quand il survient,https://www.parlament.ch/fr/ratsbetrieb/amtliches-bulletin/amtliches-bulletin-die-verhandlungen?SubjectId=40112
42,16.080,Conseil national - 03.05.2017-08:00 - Objet du Conseil fédéral,Transport régional de voyageurs 2018-2021. Crédit d‘engagement,https://www.parlament.ch/fr/ratsbetrieb/amtliches-bulletin/amtliches-bulletin-die-verhandlungen?SubjectId=40068
43,16.055,Conseil national - 02.05.2017-14:30 - Objet du Conseil fédéral,Aides financières à l’accueil extra-familial pour enfants. Modification,https://www.parlament.ch/fr/ratsbetrieb/amtliches-bulletin/amtliches-bulletin-die-verhandlungen?SubjectId=40055
44,16.045,Conseil national - 15.03.2017-15:00 - Objet du Conseil fédéral,Programme de stabilisation 2017-2019,https://www.parlament.ch/fr/ratsbetrieb/amtliches-bulletin/amtliches-bulletin-die-verhandlungen?SubjectId=39742
45,16.045,Conseil national - 14.03.2017-08:00 - Objet du Conseil fédéral,Programme de stabilisation 2017-2019,https://www.parlament.ch/fr/ratsbetrieb/amtliches-bulletin/amtliches-bulletin-die-verhandlungen?SubjectId=39609
46,16.064,Conseil national - 27.02.2017-14:30 - Objet du Conseil fédéral,Loi sur le Contrôle des finances. Révision partielle,https://www.parlament.ch/fr/ratsbetrieb/amtliches-bulletin/amtliches-bulletin-die-verhandlungen?SubjectId=39246
47,16.045,Conseil national - 27.02.2017-14:30 - Objet du Conseil fédéral,Programme de stabilisation 2017-2019,https://www.parlament.ch/fr/ratsbetrieb/amtliches-bulletin/amtliches-bulletin-die-verhandlungen?SubjectId=39245
48,15.057,Conseil national - 15.12.2016-08:00 - Objet du Conseil fédéral,Oui à la protection de la sphère privée. Initiative populaire,https://www.parlament.ch/fr/ratsbetrieb/amtliches-bulletin/amtliches-bulletin-die-verhandlungen?SubjectId=38994
49,16.056,Conseil national - 06.12.2016-08:00 - Objet du Conseil fédéral,Loi sur le génie génétique. Modification,https://www.parlament.ch/fr/ratsbetrieb/amtliches-bulletin/amtliches-bulletin-die-verhandlungen?SubjectId=38797
50,16.040,Conseil national - 06.12.2016-08:00 - Objet du Conseil fédéral,Financement de l'infrastructure ferroviaire suisse pour les années 2017-2020,https://www.parlament.ch/fr/ratsbetrieb/amtliches-bulletin/amtliches-bulletin-die-verhandlungen?SubjectId=38786
51,16.041,Conseil national - 01.12.2016-08:00 - Objet du Conseil fédéral,Budget 2017 assorti du plan intégré des tâches et des finances 2018-2020,https://www.parlament.ch/fr/ratsbetrieb/amtliches-bulletin/amtliches-bulletin-die-verhandlungen?SubjectId=38687
52,16.041,Conseil national - 30.11.2016-08:00 - Objet du Conseil fédéral,Budget 2017 assorti du plan intégré des tâches et des finances 2018-2020,https://www.parlament.ch/fr/ratsbetrieb/amtliches-bulletin/amtliches-bulletin-die-verhandlungen?SubjectId=38684
53,16.045,Conseil national - 30.11.2016-08:00 - Objet du Conseil fédéral,Programme de stabilisation 2017-2019,https://www.parlament.ch/fr/ratsbetrieb/amtliches-bulletin/amtliches-bulletin-die-verhandlungen?SubjectId=38681
54,16.045,Conseil national - 29.11.2016-08:00 - Objet du Conseil fédéral,Programme de stabilisation 2017-2019,https://www.parlament.ch/fr/ratsbetrieb/amtliches-bulletin/amtliches-bulletin-die-verhandlungen?SubjectId=38672
55,16.045,Conseil national - 28.11.2016-14:30 - Objet du Conseil fédéral,Programme de stabilisation 2017-2019,https://www.parlament.ch/fr/ratsbetrieb/amtliches-bulletin/amtliches-bulletin-die-verhandlungen?SubjectId=38668
56,16.3634,Conseil national - 28.11.2016-14:30 - Motion - Commission des finances-Conseil national,Pas de relâchement du frein à l'endettement,https://www.parlament.ch/fr/ratsbetrieb/amtliches-bulletin/amtliches-bulletin-die-verhandlungen?SubjectId=38667
57,16.5388,Conseil national - 26.09.2016-14:30 - Heure des questions. Question - Grin Jean-Pierre,Politique climatique. Plus d'allègement fiscal pour les biocarburants au-delà de 2020!,https://www.parlament.ch/fr/ratsbetrieb/amtliches-bulletin/amtliches-bulletin-die-verhandlungen?SubjectId=38205
58,16.027,Conseil national - 21.09.2016-15:00 - Objet du Conseil fédéral,Loi sur les étrangers. Gestion de I‘immigration et amélioration de la mise en oeuvre des accords sur la libre circulation des personnes,https://www.parlament.ch/fr/ratsbetrieb/amtliches-bulletin/amtliches-bulletin-die-verhandlungen?SubjectId=38167
59,14.3831,Conseil national - 19.09.2016-14:30 - Postulat - Grin Jean-Pierre,Indemnités des personnes s'investissant dans des tâches publiques. Modifications de la LHID et de la LIFD,https://www.parlament.ch/fr/ratsbetrieb/amtliches-bulletin/amtliches-bulletin-die-verhandlungen?SubjectId=38029
60,16.038,Conseil national - 15.09.2016-08:00 - Objet du Conseil fédéral,Moyens financiers destinés à l'agriculture pour les années 2018-2021,https://www.parlament.ch/fr/ratsbetrieb/amtliches-bulletin/amtliches-bulletin-die-verhandlungen?SubjectId=37978
61,14.3769,Conseil national - 16.06.2016-08:00 - Postulat - Grin Jean-Pierre,Ligne CFF Yverdon-Payerne. Le Conseil fédéral doit maintenir le transport des marchandises par le rail!,https://www.parlament.ch/fr/ratsbetrieb/amtliches-bulletin/amtliches-bulletin-die-verhandlungen?SubjectId=37573
62,16.005,Conseil national - 15.06.2016-15:00 - Objet du Parlement,Haute surveillance sur la construction de la NLFA en 2015,https://www.parlament.ch/fr/ratsbetrieb/amtliches-bulletin/amtliches-bulletin-die-verhandlungen?SubjectId=37542
63,16.5289,Conseil national - 13.06.2016-14:30 - Heure des questions. Question - Grin Jean-Pierre,Prestations d'assurance chômage aussi en cas de maintien du contrat de travail par l'employeur?,https://www.parlament.ch/fr/ratsbetrieb/amtliches-bulletin/amtliches-bulletin-die-verhandlungen?SubjectId=37413
64,15.4084,"Conseil national - 08.06.2016-08:00 - Postulat - Commission de la science, de l'éducation et de la culture-Conseil national",Etude de l'impact du glyphosate en Suisse,https://www.parlament.ch/fr/ratsbetrieb/amtliches-bulletin/amtliches-bulletin-die-verhandlungen?SubjectId=37383
65,15.431,Conseil national - 31.05.2016-08:00 - Initiative parlementaire - Groupe de l'Union démocratique du Centre,Pas de prestations de l'Etat pour les personnes résidant illégalement en Suisse,https://www.parlament.ch/fr/ratsbetrieb/amtliches-bulletin/amtliches-bulletin-die-verhandlungen?SubjectId=37260
66,16.003,Conseil national - 31.05.2016-08:00 - Objet du Conseil fédéral,Compte d'Etat 2015,https://www.parlament.ch/fr/ratsbetrieb/amtliches-bulletin/amtliches-bulletin-die-verhandlungen?SubjectId=37242
67,16.031,Conseil national - 27.04.2016-15:00 - Objet du Conseil fédéral,Imposition des immeubles agricoles et sylvicoles. Loi,https://www.parlament.ch/fr/ratsbetrieb/amtliches-bulletin/amtliches-bulletin-die-verhandlungen?SubjectId=37199
68,16.031,Conseil national - 27.04.2016-08:00 - Objet du Conseil fédéral,Imposition des immeubles agricoles et sylvicoles. Loi,https://www.parlament.ch/fr/ratsbetrieb/amtliches-bulletin/amtliches-bulletin-die-verhandlungen?SubjectId=37198
69,15.082,Conseil national - 26.04.2016-15:00 - Objet du Conseil fédéral,Réparation de l’injustice faite aux enfants placés de force et aux victimes de mesures de coercition prises à des fins d’assistance (Initiative sur la réparation). Initiative populaire et contre-projet indirect,https://www.parlament.ch/fr/ratsbetrieb/amtliches-bulletin/amtliches-bulletin-die-verhandlungen?SubjectId=37187
70,14.026,Conseil national - 17.03.2016-15:00 - Objet du Conseil fédéral,Pour un approvisionnement en électricité sûr et économique (Initiative efficacité électrique). Initiative populaire,https://www.parlament.ch/fr/ratsbetrieb/amtliches-bulletin/amtliches-bulletin-die-verhandlungen?SubjectId=36985
71,16.9006,Conseil national - 16.03.2016-08:15,"Débat d'actualité.
Situation économique",https://www.parlament.ch/fr/ratsbetrieb/amtliches-bulletin/amtliches-bulletin-die-verhandlungen?SubjectId=36948
72,16.019,Conseil national - 10.03.2016-08:00 - Motion;Objet du Conseil fédéral - Commission des finances-Conseil national,Conséquences économiques et fiscales des différents modèles d'imposition individuelle. Rapport du Conseil fédéral (Po.14.3005 CdF-N),https://www.parlament.ch/fr/ratsbetrieb/amtliches-bulletin/amtliches-bulletin-die-verhandlungen?SubjectId=36829
73,15.3011,"Conseil national - 09.03.2016-15:00 - Motion - Commission de la science, de l'éducation et de la culture-Conseil national",Période FRI 2017-2020. Mettre en oeuvre les réformes nécessaires sans compromettre la qualité,https://www.parlament.ch/fr/ratsbetrieb/amtliches-bulletin/amtliches-bulletin-die-verhandlungen?SubjectId=36800
74,15.050,Conseil national - 09.03.2016-08:00 - Objet du Conseil fédéral,Pour la sécurité alimentaire. Initiative populaire,https://www.parlament.ch/fr/ratsbetrieb/amtliches-bulletin/amtliches-bulletin-die-verhandlungen?SubjectId=36787
75,16.5013,Conseil national - 07.03.2016-14:30 - Heure des questions. Question - Grin Jean-Pierre,Vallorbe. Transformation du centre d'enregistrement pour requérants d'asile en centre de départ,https://www.parlament.ch/fr/ratsbetrieb/amtliches-bulletin/amtliches-bulletin-die-verhandlungen?SubjectId=36698
76,15.041,Conseil national - 17.12.2015-08:00 - Objet du Conseil fédéral,Budget 2016,https://www.parlament.ch/fr/ratsbetrieb/amtliches-bulletin/amtliches-bulletin-die-verhandlungen?SubjectId=36332
77,14.087,Conseil national - 16.12.2015-15:00 - Objet du Conseil fédéral,AVSplus: pour une AVS forte. Initiative populaire,https://www.parlament.ch/fr/ratsbetrieb/amtliches-bulletin/amtliches-bulletin-die-verhandlungen?SubjectId=36330
78,15.041,Conseil national - 15.12.2015-08:00 - Objet du Conseil fédéral,Budget 2016,https://www.parlament.ch/fr/ratsbetrieb/amtliches-bulletin/amtliches-bulletin-die-verhandlungen?SubjectId=36289
79,15.041,Conseil national - 10.12.2015-08:00 - Objet du Conseil fédéral,Budget 2016,https://www.parlament.ch/fr/ratsbetrieb/amtliches-bulletin/amtliches-bulletin-die-verhandlungen?SubjectId=36185
80,15.041,Conseil national - 07.12.2015-14:30 - Objet du Conseil fédéral,Budget 2016,https://www.parlament.ch/fr/ratsbetrieb/amtliches-bulletin/amtliches-bulletin-die-verhandlungen?SubjectId=36109
81,15.041,Conseil national - 03.12.2015-08:00 - Objet du Conseil fédéral,Budget 2016,https://www.parlament.ch/fr/ratsbetrieb/amtliches-bulletin/amtliches-bulletin-die-verhandlungen?SubjectId=36071
82,15.041,Conseil national - 03.12.2015-08:00 - Objet du Conseil fédéral,Budget 2016,https://www.parlament.ch/fr/ratsbetrieb/amtliches-bulletin/amtliches-bulletin-die-verhandlungen?SubjectId=36065
83,14.069,Conseil national - 02.12.2015-08:00 - Objet du Conseil fédéral,Développement de l’armée. Modification des bases légales,https://www.parlament.ch/fr/ratsbetrieb/amtliches-bulletin/amtliches-bulletin-die-verhandlungen?SubjectId=36053
84,14.019,Conseil national - 01.12.2015-08:00 - Objet du Conseil fédéral,Pour une économie durable et fondée sur une gestion efficiente des ressources (économie verte). Initiative populaire et contre-projet indirect,https://www.parlament.ch/fr/ratsbetrieb/amtliches-bulletin/amtliches-bulletin-die-verhandlungen?SubjectId=36027
85,15.036,Conseil national - 30.11.2015-14:30 - Objet du Conseil fédéral,FIPOI. Aides financières à la reconstruction du FISCR à Genève,https://www.parlament.ch/fr/ratsbetrieb/amtliches-bulletin/amtliches-bulletin-die-verhandlungen?SubjectId=36025
86,15.3013,Conseil national - 24.09.2015-15:00 - Motion - Commission des finances-Conseil national,Examen stratégique des tâches de la Confédération,https://www.parlament.ch/fr/ratsbetrieb/amtliches-bulletin/amtliches-bulletin-die-verhandlungen?SubjectId=35726
87,15.3812,Conseil national - 23.09.2015-15:00 - Interpellation urgente - Groupe socialiste,Accélérer la transition énergétique pour réduire les risques climatiques et nucléaires,https://www.parlament.ch/fr/ratsbetrieb/amtliches-bulletin/amtliches-bulletin-die-verhandlungen?SubjectId=35698
88,14.058,Conseil national - 23.09.2015-15:00 - Objet du Conseil fédéral,Pour un revenu de base inconditionnel. Initiative populaire,https://www.parlament.ch/fr/ratsbetrieb/amtliches-bulletin/amtliches-bulletin-die-verhandlungen?SubjectId=35705
89,15.021,Conseil national - 17.09.2015-08:00 - Objet du Conseil fédéral,Pas de spéculation sur les denrées alimentaires. Initiative populaire,https://www.parlament.ch/fr/ratsbetrieb/amtliches-bulletin/amtliches-bulletin-die-verhandlungen?SubjectId=35065
90,14.059,Conseil national - 15.09.2015-08:00 - Objet du Conseil fédéral,Loi sur le service civil. Modification,https://www.parlament.ch/fr/ratsbetrieb/amtliches-bulletin/amtliches-bulletin-die-verhandlungen?SubjectId=35062
91,14.019,Conseil national - 14.09.2015-14:30 - Objet du Conseil fédéral,Pour une économie durable et fondée sur une gestion efficiente des ressources (économie verte). Initiative populaire et contre-projet indirect,https://www.parlament.ch/fr/ratsbetrieb/amtliches-bulletin/amtliches-bulletin-die-verhandlungen?SubjectId=35099
92,15.3011,"Conseil national - 19.06.2015-08:00 - Motion - Commission de la science, de l'éducation et de la culture-Conseil national",Période FRI 2017-2020. Mettre en oeuvre les réformes nécessaires sans compromettre la qualité,https://www.parlament.ch/fr/ratsbetrieb/amtliches-bulletin/amtliches-bulletin-die-verhandlungen?SubjectId=35562
93,14.077,Conseil national - 17.06.2015-08:25 - Objet du Conseil fédéral,Modèle comptable de la Confédération. Optimisation,https://www.parlament.ch/fr/ratsbetrieb/amtliches-bulletin/amtliches-bulletin-die-verhandlungen?SubjectId=30665
94,15.017,Conseil national - 16.06.2015-08:00 - Objet du Conseil fédéral,Programme d'armement 2015,https://www.parlament.ch/fr/ratsbetrieb/amtliches-bulletin/amtliches-bulletin-die-verhandlungen?SubjectId=32018
95,15.5285,Conseil national - 15.06.2015-14:30 - Heure des questions. Question - Grin Jean-Pierre,Capture de lynx,https://www.parlament.ch/fr/ratsbetrieb/amtliches-bulletin/amtliches-bulletin-die-verhandlungen?SubjectId=33463
96,15.003,Conseil national - 11.06.2015-08:00 - Objet du Conseil fédéral,Compte d'Etat 2014,https://www.parlament.ch/fr/ratsbetrieb/amtliches-bulletin/amtliches-bulletin-die-verhandlungen?SubjectId=30667
97,12.101,Conseil national - 11.06.2015-08:00 - Objet du Conseil fédéral,Programme de consolidation et de réexamen des tâches. Loi,https://www.parlament.ch/fr/ratsbetrieb/amtliches-bulletin/amtliches-bulletin-die-verhandlungen?SubjectId=30668
