,no,label,title,href
0,19.001,Conseil des Etats - 13.06.2019-08:15 - Objet du Conseil fédéral,Rapport de gestion du Conseil fédéral 2018,https://www.parlament.ch/fr/ratsbetrieb/amtliches-bulletin/amtliches-bulletin-die-verhandlungen?SubjectId=46335
1,19.002,Conseil des Etats - 13.06.2019-08:15 - Objet du Conseil fédéral,Rapport de gestion 2018 du Tribunal fédéral,https://www.parlament.ch/fr/ratsbetrieb/amtliches-bulletin/amtliches-bulletin-die-verhandlungen?SubjectId=46334
2,18.048,Conseil des Etats - 04.06.2019-08:15 - Objet du Conseil fédéral,Transfèrement des personnes condamnées. Amendement au Protocole additionnel,https://www.parlament.ch/fr/ratsbetrieb/amtliches-bulletin/amtliches-bulletin-die-verhandlungen?SubjectId=46138
3,18.3459,Conseil des Etats - 21.03.2019-08:15 - Motion - Vonlanthen Beat,Promotion de modèles d'enseignement dans deux langues nationales. Contribution de la Confédération,https://www.parlament.ch/fr/ratsbetrieb/amtliches-bulletin/amtliches-bulletin-die-verhandlungen?SubjectId=45817
4,18.313,Conseil des Etats - 20.03.2019-08:30 - Initiative cantonale - Genève,Donner aux cantons les moyens de réaliser l'égalité entre femmes et hommes,https://www.parlament.ch/fr/ratsbetrieb/amtliches-bulletin/amtliches-bulletin-die-verhandlungen?SubjectId=45785
5,19.004,Conseil des Etats - 20.03.2019-08:30 - Objet du Parlement,Rapport annuel 2018 des CdG et de la DélCdG,https://www.parlament.ch/fr/ratsbetrieb/amtliches-bulletin/amtliches-bulletin-die-verhandlungen?SubjectId=45780
6,16.077,Conseil des Etats - 12.03.2019-08:15 - Objet du Conseil fédéral,CO. Droit de la société anonyme,https://www.parlament.ch/fr/ratsbetrieb/amtliches-bulletin/amtliches-bulletin-die-verhandlungen?SubjectId=45539
7,17.4241,Conseil des Etats - 12.12.2018-08:30 - Motion - Sommaruga Carlo,Signer et ratifier le traité sur l'interdiction des armes nucléaires,https://www.parlament.ch/fr/ratsbetrieb/amtliches-bulletin/amtliches-bulletin-die-verhandlungen?SubjectId=44998
8,17.019,Conseil des Etats - 10.12.2018-15:15 - Objet du Conseil fédéral,Loi sur les marchés publics. Révision totale,https://www.parlament.ch/fr/ratsbetrieb/amtliches-bulletin/amtliches-bulletin-die-verhandlungen?SubjectId=44953
9,18.3935,Conseil des Etats - 29.11.2018-08:15 - Motion;Postulat - Germann Hannes,La Suisse ne doit pas signer le pacte de l'ONU sur les migrations,https://www.parlament.ch/fr/ratsbetrieb/amtliches-bulletin/amtliches-bulletin-die-verhandlungen?SubjectId=44748
10,16.3848,Conseil des Etats - 28.11.2018-08:15 - Motion - Candinas Martin,Distribution du courrier sur l'ensemble du territoire au plus tard à la mi-journée,https://www.parlament.ch/fr/ratsbetrieb/amtliches-bulletin/amtliches-bulletin-die-verhandlungen?SubjectId=44734
11,13.407,Conseil des Etats - 28.11.2018-08:15 - Initiative parlementaire - Reynard Mathias,Lutter contre les discriminations basées sur l'orientation sexuelle,https://www.parlament.ch/fr/ratsbetrieb/amtliches-bulletin/amtliches-bulletin-die-verhandlungen?SubjectId=44732
12,17.047,Conseil des Etats - 28.11.2018-08:15 - Objet du Conseil fédéral,Loi sur l'égalité. Modification,https://www.parlament.ch/fr/ratsbetrieb/amtliches-bulletin/amtliches-bulletin-die-verhandlungen?SubjectId=44730
13,18.001,Conseil des Etats - 27.09.2018-08:15 - Objet du Conseil fédéral,Rapport de gestion du Conseil fédéral 2017,https://www.parlament.ch/fr/ratsbetrieb/amtliches-bulletin/amtliches-bulletin-die-verhandlungen?SubjectId=44434
14,16.477,Conseil des Etats - 26.09.2018-08:45 - Initiative parlementaire - Addor Jean-Luc,Renforcer la lutte contre les réseaux de passeurs,https://www.parlament.ch/fr/ratsbetrieb/amtliches-bulletin/amtliches-bulletin-die-verhandlungen?SubjectId=44384
15,15.4126,Conseil des Etats - 19.09.2018-08:15 - Motion;Pétition - Geissbühler Andrea Martina,Activer un retour sans risque de persécution pour les Erythréens,https://www.parlament.ch/fr/ratsbetrieb/amtliches-bulletin/amtliches-bulletin-die-verhandlungen?SubjectId=44089
16,17.497,"Conseil des Etats - 18.09.2018-08:15 - Initiative parlementaire - Commission de la science, de l'éducation et de la culture-Conseil national",Aides financières à l'accueil extrafamilial pour enfants. Prolonger le programme d'impulsion de la Confédération,https://www.parlament.ch/fr/ratsbetrieb/amtliches-bulletin/amtliches-bulletin-die-verhandlungen?SubjectId=44054
17,17.3510,Conseil des Etats - 31.05.2018-08:15 - Motion - Fournier Jean-René,Contrat de prestations du Centre équestre national de Berne,https://www.parlament.ch/fr/ratsbetrieb/amtliches-bulletin/amtliches-bulletin-die-verhandlungen?SubjectId=43268
18,17.048,Conseil des Etats - 30.05.2018-08:15 - Objet du Conseil fédéral,Analyse génétique humaine. Loi,https://www.parlament.ch/fr/ratsbetrieb/amtliches-bulletin/amtliches-bulletin-die-verhandlungen?SubjectId=43249
19,17.047,Conseil des Etats - 29.05.2018-08:15 - Objet du Conseil fédéral,Loi sur l'égalité. Modification,https://www.parlament.ch/fr/ratsbetrieb/amtliches-bulletin/amtliches-bulletin-die-verhandlungen?SubjectId=43229
20,17.4204,Conseil des Etats - 07.03.2018-08:15 - Postulat - Seydoux-Christe Anne,La supervision bancaire est-elle suffisante pour juguler les risques de blanchiment dans le secteur des matières premières?,https://www.parlament.ch/fr/ratsbetrieb/amtliches-bulletin/amtliches-bulletin-die-verhandlungen?SubjectId=42672
21,18.004,Conseil des Etats - 06.03.2018-08:15 - Objet du Parlement,Rapport annuel 2017 des CdG et de la DélCdG,https://www.parlament.ch/fr/ratsbetrieb/amtliches-bulletin/amtliches-bulletin-die-verhandlungen?SubjectId=42637
22,17.047,Conseil des Etats - 28.02.2018-08:15 - Objet du Conseil fédéral,Loi sur l'égalité. Modification,https://www.parlament.ch/fr/ratsbetrieb/amtliches-bulletin/amtliches-bulletin-die-verhandlungen?SubjectId=42404
23,17.3725,Conseil des Etats - 13.12.2017-08:30 - Interpellation - Maury Pasquier Liliane,Renvois Dublin. Négligence ou rétention d'informations?,https://www.parlament.ch/fr/ratsbetrieb/amtliches-bulletin/amtliches-bulletin-die-verhandlungen?SubjectId=42039
24,16.309,Conseil des Etats - 19.09.2017-08:15 - Initiative cantonale - Jura,Crise laitière et gestion des volumes,https://www.parlament.ch/fr/ratsbetrieb/amtliches-bulletin/amtliches-bulletin-die-verhandlungen?SubjectId=40996
25,17.3450,Conseil des Etats - 11.09.2017-16:15 - Interpellation - Seydoux-Christe Anne,"Guerre en Syrie. Accroître l'aide humanitaire, adapter l'accueil des Syriens déplacés par la guerre aux nouvelles circonstances",https://www.parlament.ch/fr/ratsbetrieb/amtliches-bulletin/amtliches-bulletin-die-verhandlungen?SubjectId=40880
26,17.3043,Conseil des Etats - 13.06.2017-08:15 - Interpellation - Seydoux-Christe Anne,Mise en oeuvre de la nouvelle loi sur les écoles suisses à l'étranger,https://www.parlament.ch/fr/ratsbetrieb/amtliches-bulletin/amtliches-bulletin-die-verhandlungen?SubjectId=40499
27,17.002,Conseil des Etats - 07.06.2017-08:15 - Objet du Conseil fédéral,Rapport de gestion 2016 du Tribunal fédéral,https://www.parlament.ch/fr/ratsbetrieb/amtliches-bulletin/amtliches-bulletin-die-verhandlungen?SubjectId=40341
28,17.004,Conseil des Etats - 16.03.2017-08:15 - Objet du Parlement,Rapport annuel 2016 des CdG et de la DélCdG,https://www.parlament.ch/fr/ratsbetrieb/amtliches-bulletin/amtliches-bulletin-die-verhandlungen?SubjectId=39774
29,16.055,Conseil des Etats - 14.03.2017-08:15 - Objet du Conseil fédéral,Aides financières à l’accueil extra-familial pour enfants. Modification,https://www.parlament.ch/fr/ratsbetrieb/amtliches-bulletin/amtliches-bulletin-die-verhandlungen?SubjectId=39612
30,16.4091,Conseil des Etats - 27.02.2017-16:15 - Interpellation - Seydoux-Christe Anne,Cas Dublin et clause de souveraineté. Rapprochement de membres d'une même famille et droits de l'enfant,https://www.parlament.ch/fr/ratsbetrieb/amtliches-bulletin/amtliches-bulletin-die-verhandlungen?SubjectId=39272
31,16.486,Conseil des Etats - 27.02.2017-16:15 - Initiative parlementaire - Commission des affaires juridiques-Conseil des Etats,Augmentation temporaire du nombre de postes de juge au Tribunal administratif fédéral,https://www.parlament.ch/fr/ratsbetrieb/amtliches-bulletin/amtliches-bulletin-die-verhandlungen?SubjectId=39249
32,16.3734,Conseil des Etats - 15.12.2016-08:15 - Interpellation - Seydoux-Christe Anne,Quel soutien pour les familles yézidies?,https://www.parlament.ch/fr/ratsbetrieb/amtliches-bulletin/amtliches-bulletin-die-verhandlungen?SubjectId=38999
33,15.3804,Conseil des Etats - 15.12.2016-08:15 - Motion - de Courten Thomas,Renoncement à la ratification de la Charte sociale européenne,https://www.parlament.ch/fr/ratsbetrieb/amtliches-bulletin/amtliches-bulletin-die-verhandlungen?SubjectId=38996
34,16.055,Conseil des Etats - 28.11.2016-16:15 - Objet du Conseil fédéral,Aides financières à l’accueil extra-familial pour enfants. Modification,https://www.parlament.ch/fr/ratsbetrieb/amtliches-bulletin/amtliches-bulletin-die-verhandlungen?SubjectId=38669
35,14.3219,Conseil des Etats - 15.06.2016-08:20 - Motion - Reimann Lukas,Retirer la demande d'adhésion à l'UE et dire les choses telles qu'elles sont,https://www.parlament.ch/fr/ratsbetrieb/amtliches-bulletin/amtliches-bulletin-die-verhandlungen?SubjectId=37526
36,16.002,Conseil des Etats - 15.06.2016-08:20 - Objet du Conseil fédéral,Rapport de gestion 2015 du Tribunal fédéral,https://www.parlament.ch/fr/ratsbetrieb/amtliches-bulletin/amtliches-bulletin-die-verhandlungen?SubjectId=37511
37,16.021,Conseil des Etats - 14.06.2016-08:15 - Objet du Parlement,Activités des délégations permanentes chargées des relations avec les parlements des Etats limitrophes. Rapport de la 49ème législature,https://www.parlament.ch/fr/ratsbetrieb/amtliches-bulletin/amtliches-bulletin-die-verhandlungen?SubjectId=37481
38,15.069,Conseil des Etats - 07.06.2016-08:15 - Objet du Conseil fédéral,Loi sur les jeux d’argent,https://www.parlament.ch/fr/ratsbetrieb/amtliches-bulletin/amtliches-bulletin-die-verhandlungen?SubjectId=37359
39,16.3098,Conseil des Etats - 06.06.2016-15:15 - Postulat - Seydoux-Christe Anne,Une stratégie valeur ajoutée en plus d'une stratégie qualité,https://www.parlament.ch/fr/ratsbetrieb/amtliches-bulletin/amtliches-bulletin-die-verhandlungen?SubjectId=37304
40,16.3061,Conseil des Etats - 06.06.2016-15:15 - Postulat - Seydoux-Christe Anne,Sauver la race de chevaux franches-montagnes et le savoir-faire des éleveurs,https://www.parlament.ch/fr/ratsbetrieb/amtliches-bulletin/amtliches-bulletin-die-verhandlungen?SubjectId=37302
41,16.028,Conseil des Etats - 02.06.2016-08:15 - Objet du Conseil fédéral,Accord sur la libre circulation. Extension à la Croatie,https://www.parlament.ch/fr/ratsbetrieb/amtliches-bulletin/amtliches-bulletin-die-verhandlungen?SubjectId=37271
42,16.3082,Conseil des Etats - 31.05.2016-08:15 - Interpellation - Seydoux-Christe Anne,"Interprétation extensive, voire excessive, de l'article 30 alinéa 1bis OAT par l'Office fédéral du développement territorial",https://www.parlament.ch/fr/ratsbetrieb/amtliches-bulletin/amtliches-bulletin-die-verhandlungen?SubjectId=37251
43,14.094,Conseil des Etats - 08.03.2016-08:15 - Objet du Conseil fédéral,CC. Droit de l’adoption. Modification,https://www.parlament.ch/fr/ratsbetrieb/amtliches-bulletin/amtliches-bulletin-die-verhandlungen?SubjectId=36767
44,15.030,Conseil des Etats - 29.02.2016-16:15 - Objet du Conseil fédéral,Convention de sauvegarde des droits de l'homme et des libertés fondamentales. Protocole no 15. Approbation,https://www.parlament.ch/fr/ratsbetrieb/amtliches-bulletin/amtliches-bulletin-die-verhandlungen?SubjectId=36579
45,13.3272,Conseil des Etats - 08.12.2015-08:15 - Motion - Carobbio Guscetti Marina,Stage facilitant le retour à la vie active. Rôle de l'Etat,https://www.parlament.ch/fr/ratsbetrieb/amtliches-bulletin/amtliches-bulletin-die-verhandlungen?SubjectId=36167
46,15.055,Conseil des Etats - 07.12.2015-15:15 - Objet du Conseil fédéral,"40 ans d'adhésion de la Suisse à la CEDH. Bilan et perspectives. Rapport du Conseil fédéral (Po. Stöckli., 13.4187)",https://www.parlament.ch/fr/ratsbetrieb/amtliches-bulletin/amtliches-bulletin-die-verhandlungen?SubjectId=36113
47,15.031,Conseil des Etats - 09.09.2015-08:15 - Objet du Conseil fédéral,Parc National de l'Innovation en Suisse. Organisation et soutien,https://www.parlament.ch/fr/ratsbetrieb/amtliches-bulletin/amtliches-bulletin-die-verhandlungen?SubjectId=34936
48,08.047,Conseil des Etats - 08.09.2015-08:15 - Objet du Conseil fédéral,Loi fédérale sur l'assurance-accident. Modification,https://www.parlament.ch/fr/ratsbetrieb/amtliches-bulletin/amtliches-bulletin-die-verhandlungen?SubjectId=34927
49,15.3221,Conseil des Etats - 17.06.2015-08:30 - Interpellation - Seydoux-Christe Anne,Une stratégie pour renforcer la position des agriculteurs face au commerce?,https://www.parlament.ch/fr/ratsbetrieb/amtliches-bulletin/amtliches-bulletin-die-verhandlungen?SubjectId=34913
50,13.427,Conseil des Etats - 19.03.2015-08:15 - Initiative parlementaire - Schneider Schüttel Ursula,Code de procédure pénale. Simplification de la procédure par défaut,https://www.parlament.ch/fr/ratsbetrieb/amtliches-bulletin/amtliches-bulletin-die-verhandlungen?SubjectId=31947
51,12.434,Conseil des Etats - 19.03.2015-08:15 - Initiative parlementaire - Commission des affaires juridiques-Conseil des Etats,Elections par l'Assemblée fédérale. Indemnité de départ en cas de non-réélection et modalités de réélection,https://www.parlament.ch/fr/ratsbetrieb/amtliches-bulletin/amtliches-bulletin-die-verhandlungen?SubjectId=31950
52,14.309,Conseil des Etats - 18.03.2015-08:15 - Initiative cantonale - Neuchâtel,Congé maternel d'adoption,https://www.parlament.ch/fr/ratsbetrieb/amtliches-bulletin/amtliches-bulletin-die-verhandlungen?SubjectId=34004
53,13.085,Conseil des Etats - 04.03.2015-08:15 - Objet du Conseil fédéral,Pour le couple et la famille - Non à la pénalisation du mariage. Initiative populaire,https://www.parlament.ch/fr/ratsbetrieb/amtliches-bulletin/amtliches-bulletin-die-verhandlungen?SubjectId=30541
54,14.3919,Conseil des Etats - 11.12.2014-08:15 - Postulat - Seydoux-Christe Anne,Prise en charge par l'assurance obligatoire des soins des traitements consécutifs à des mutilations sexuelles féminines,https://www.parlament.ch/fr/ratsbetrieb/amtliches-bulletin/amtliches-bulletin-die-verhandlungen?SubjectId=30528
55,12.3511,Conseil des Etats - 11.12.2014-08:15 - Motion;Postulat - Aebischer Matthias,Equivalence des diplômes de la formation professionnelle supérieure,https://www.parlament.ch/fr/ratsbetrieb/amtliches-bulletin/amtliches-bulletin-die-verhandlungen?SubjectId=30525
56,14.3663,Conseil des Etats - 26.11.2014-08:15 - Postulat - Commission de politique extérieure-Conseil des Etats,Accès à la réparation,https://www.parlament.ch/fr/ratsbetrieb/amtliches-bulletin/amtliches-bulletin-die-verhandlungen?SubjectId=30327
57,14.021,Conseil des Etats - 26.11.2014-08:15 - Objet du Conseil fédéral,Cour pénale internationale. Amendement du Statut de Rome (crime d’agression et crimes de guerre),https://www.parlament.ch/fr/ratsbetrieb/amtliches-bulletin/amtliches-bulletin-die-verhandlungen?SubjectId=30329
58,14.3126,Conseil des Etats - 16.09.2014-08:15 - Motion - Schneider-Schneiter Elisabeth,Pas de cotisations AVS pour le baby-sitting et les activités domestiques,https://www.parlament.ch/fr/ratsbetrieb/amtliches-bulletin/amtliches-bulletin-die-verhandlungen?SubjectId=27424
59,13.051,Conseil des Etats - 08.09.2014-16:15 - Objet du Conseil fédéral,Diagnostic préimplantatoire. Modification de la Constitution et de la loi sur la procréation médicalement assistée,https://www.parlament.ch/fr/ratsbetrieb/amtliches-bulletin/amtliches-bulletin-die-verhandlungen?SubjectId=27263
