,no,label,title,href
0,17.060,Conseil national - 13.06.2019-08:00 - Objet du Conseil fédéral,Entreprises responsables – pour protéger l’être humain et l’environnement. Initiative populaire,https://www.parlament.ch/fr/ratsbetrieb/amtliches-bulletin/amtliches-bulletin-die-verhandlungen?SubjectId=46336
1,19.019,Conseil national - 06.06.2019-08:00 - Objet du Conseil fédéral,Renforcer le rôle de la Suisse comme Etat hôte 2020-2023. Mesures,https://www.parlament.ch/fr/ratsbetrieb/amtliches-bulletin/amtliches-bulletin-die-verhandlungen?SubjectId=46222
2,17.3615,Conseil national - 04.06.2019-08:00 - Postulat - Béglé Claude,Orientation stratégique pour assurer le succès de la Poste à moyen terme,https://www.parlament.ch/fr/ratsbetrieb/amtliches-bulletin/amtliches-bulletin-die-verhandlungen?SubjectId=46165
3,17.3592,Conseil national - 04.06.2019-08:00 - Motion - Béglé Claude,Faire évoluer la gouvernance du numérique vers un mode de gouvernance inspiré du numérique,https://www.parlament.ch/fr/ratsbetrieb/amtliches-bulletin/amtliches-bulletin-die-verhandlungen?SubjectId=46159
4,17.3591,Conseil national - 04.06.2019-08:00 - Motion - Béglé Claude,Neutralité du Net. Préserver la vitalité originelle de l'Internet,https://www.parlament.ch/fr/ratsbetrieb/amtliches-bulletin/amtliches-bulletin-die-verhandlungen?SubjectId=46151
5,19.009,Conseil national - 21.03.2019-08:00 - Objet du Conseil fédéral,Rapport de politique extérieure 2018,https://www.parlament.ch/fr/ratsbetrieb/amtliches-bulletin/amtliches-bulletin-die-verhandlungen?SubjectId=45825
6,17.3818,Conseil national - 20.03.2019-08:30 - Motion - Béglé Claude,"Promouvoir la Suisse en tant que pôle mondial de la technologie ""blockchain""",https://www.parlament.ch/fr/ratsbetrieb/amtliches-bulletin/amtliches-bulletin-die-verhandlungen?SubjectId=45787
7,18.067,Conseil national - 18.03.2019-14:30 - Objet du Conseil fédéral,Réduction des disparités économiques et sociales dans l'Union européenne élargie. Deuxième contribution de la Suisse en faveur de certains Etats membres de l’UE,https://www.parlament.ch/fr/ratsbetrieb/amtliches-bulletin/amtliches-bulletin-die-verhandlungen?SubjectId=45644
8,18.4093,Conseil national - 11.12.2018-08:00 - Motion - Commission des institutions politiques-Conseil national,Pacte de l'ONU sur les migrations. Soumettre à l'Assemblée fédérale la décision d'approbation,https://www.parlament.ch/fr/ratsbetrieb/amtliches-bulletin/amtliches-bulletin-die-verhandlungen?SubjectId=44966
9,18.4093,Conseil national - 06.12.2018-08:00 - Motion - Commission des institutions politiques-Conseil national,Pacte de l'ONU sur les migrations. Soumettre à l'Assemblée fédérale la décision d'approbation,https://www.parlament.ch/fr/ratsbetrieb/amtliches-bulletin/amtliches-bulletin-die-verhandlungen?SubjectId=44883
10,16.3691,Conseil national - 26.09.2018-15:00 - Postulat - Béglé Claude,"Soutien à l'internationalisation des PME ""cleantech"" et autres par le maintien du budget accordé à Switzerland Global Enterprise tel que souhaité par le Parlement",https://www.parlament.ch/fr/ratsbetrieb/amtliches-bulletin/amtliches-bulletin-die-verhandlungen?SubjectId=44402
11,16.3658,Conseil national - 26.09.2018-15:00 - Postulat - Béglé Claude,"Soutenir la création d'une formation de ""fablab manager""",https://www.parlament.ch/fr/ratsbetrieb/amtliches-bulletin/amtliches-bulletin-die-verhandlungen?SubjectId=44400
12,17.303,Conseil national - 25.09.2018-08:00 - Initiative cantonale - Argovie,Pour une politique en matière de réfugiés efficace et la fin des incitations aux mouvements migratoires,https://www.parlament.ch/fr/ratsbetrieb/amtliches-bulletin/amtliches-bulletin-die-verhandlungen?SubjectId=44358
13,16.3889,Conseil national - 19.09.2018-15:00 - Postulat - Béglé Claude,"Des ""ambassadeurs"" pour promouvoir une intégration réussie",https://www.parlament.ch/fr/ratsbetrieb/amtliches-bulletin/amtliches-bulletin-die-verhandlungen?SubjectId=44135
14,16.3692,Conseil national - 18.09.2018-08:00 - Postulat - Béglé Claude,Mieux lutter contre la radicalisation en demandant aux cantons d'harmoniser leurs pratiques,https://www.parlament.ch/fr/ratsbetrieb/amtliches-bulletin/amtliches-bulletin-die-verhandlungen?SubjectId=44078
15,17.046,Conseil national - 06.06.2018-08:00 - Objet du Conseil fédéral,Le droit suisse au lieu de juges étrangers (initiative pour l’autodétermination). Initiative populaire,https://www.parlament.ch/fr/ratsbetrieb/amtliches-bulletin/amtliches-bulletin-die-verhandlungen?SubjectId=43430
16,18.3007,Conseil national - 05.06.2018-08:00 - Motion - Commission de politique extérieure-Conseil national,Les banques d'importance systémique doivent mettre à disposition des Suisses de l'étranger des informations spécifiques à leurs besoins,https://www.parlament.ch/fr/ratsbetrieb/amtliches-bulletin/amtliches-bulletin-die-verhandlungen?SubjectId=43401
17,17.063,Conseil national - 31.05.2018-08:00 - Objet du Conseil fédéral,Stopper le mitage - pour un développement durable du milieu bâti (initiative contre le mitage). Initiative populaire,https://www.parlament.ch/fr/ratsbetrieb/amtliches-bulletin/amtliches-bulletin-die-verhandlungen?SubjectId=43274
18,18.011,Conseil national - 28.05.2018-14:30 - Objet du Parlement,Délégation auprès de l'Assemblée parlementaire de l'OSCE. Rapport,https://www.parlament.ch/fr/ratsbetrieb/amtliches-bulletin/amtliches-bulletin-die-verhandlungen?SubjectId=43212
19,18.033,Conseil national - 28.05.2018-14:30 - Objet du Parlement,Déclaration du Conseil national. Stop aux crimes de guerre en Syrie,https://www.parlament.ch/fr/ratsbetrieb/amtliches-bulletin/amtliches-bulletin-die-verhandlungen?SubjectId=43203
20,17.3848,Conseil national - 15.03.2018-08:00 - Motion - Béglé Claude,Démultiplier l'aide publique grâce aux instruments incitant le secteur privé à participer,https://www.parlament.ch/fr/ratsbetrieb/amtliches-bulletin/amtliches-bulletin-die-verhandlungen?SubjectId=42892
21,17.3789,Conseil national - 15.03.2018-08:00 - Postulat - Béglé Claude,Permettre à la Suisse de devenir l'épicentre de la gouvernance internationale du numérique,https://www.parlament.ch/fr/ratsbetrieb/amtliches-bulletin/amtliches-bulletin-die-verhandlungen?SubjectId=42891
22,17.3595,Conseil national - 15.03.2018-08:00 - Postulat - Béglé Claude,Education de base et formation professionnelle. Diffuser l'expertise suisse dans les pays les plus pauvres,https://www.parlament.ch/fr/ratsbetrieb/amtliches-bulletin/amtliches-bulletin-die-verhandlungen?SubjectId=42890
23,17.3594,Conseil national - 15.03.2018-08:00 - Postulat - Béglé Claude,Complémentarité entre aide humanitaire et aide au développement de la Suisse,https://www.parlament.ch/fr/ratsbetrieb/amtliches-bulletin/amtliches-bulletin-die-verhandlungen?SubjectId=42889
24,17.3098,Conseil national - 15.03.2018-08:00 - Motion - Groupe de l'Union démocratique du Centre,Ouverture d'une ambassade de Suisse en Erythrée. Réseau extérieur au service des intérêts nationaux,https://www.parlament.ch/fr/ratsbetrieb/amtliches-bulletin/amtliches-bulletin-die-verhandlungen?SubjectId=42888
25,18.9006,Conseil national - 14.03.2018-08:15,"Interpellations urgentes.
Car postal Suisse SA",https://www.parlament.ch/fr/ratsbetrieb/amtliches-bulletin/amtliches-bulletin-die-verhandlungen?SubjectId=42860
26,17.028,Conseil national - 13.03.2018-08:00 - Objet du Conseil fédéral,Loi sur la sécurité de l‘information,https://www.parlament.ch/fr/ratsbetrieb/amtliches-bulletin/amtliches-bulletin-die-verhandlungen?SubjectId=42833
27,16.3918,Conseil national - 08.03.2018-08:00 - Postulat - Béglé Claude,"Révolution numérique. Comment intégrer les ""offliners""?",https://www.parlament.ch/fr/ratsbetrieb/amtliches-bulletin/amtliches-bulletin-die-verhandlungen?SubjectId=42714
28,18.008,Conseil national - 05.03.2018-14:30 - Objet du Conseil fédéral,Politique économique extérieure 2017. Rapport,https://www.parlament.ch/fr/ratsbetrieb/amtliches-bulletin/amtliches-bulletin-die-verhandlungen?SubjectId=42509
29,16.3381,Conseil national - 28.02.2018-15:00 - Postulat - Béglé Claude,Industrie 4.0. Créer une coordination au niveau suisse,https://www.parlament.ch/fr/ratsbetrieb/amtliches-bulletin/amtliches-bulletin-die-verhandlungen?SubjectId=42451
30,16.3262,Conseil national - 28.02.2018-15:00 - Postulat - Béglé Claude,Renforcer nos PME innovantes en les incitant à s'internationaliser,https://www.parlament.ch/fr/ratsbetrieb/amtliches-bulletin/amtliches-bulletin-die-verhandlungen?SubjectId=42446
31,16.3153,Conseil national - 28.02.2018-08:00 - Postulat - Béglé Claude,Lutter contre l'âgisme pour favoriser l'emploi des seniors,https://www.parlament.ch/fr/ratsbetrieb/amtliches-bulletin/amtliches-bulletin-die-verhandlungen?SubjectId=42439
32,17.3036,Conseil national - 28.02.2018-08:00 - Postulat - Reynard Mathias,Evaluer l'opportunité de taxer les robots,https://www.parlament.ch/fr/ratsbetrieb/amtliches-bulletin/amtliches-bulletin-die-verhandlungen?SubjectId=42424
33,16.3914,Conseil national - 28.02.2018-08:00 - Postulat - Béglé Claude,Comment introduire de l'éthique dans les algorithmes?,https://www.parlament.ch/fr/ratsbetrieb/amtliches-bulletin/amtliches-bulletin-die-verhandlungen?SubjectId=42411
34,17.3511,Conseil national - 28.02.2018-08:00 - Motion - Lombardi Filippo,Les banques d'importance systémique doivent permettre à tous les Suisses de l'étranger de disposer d'un compte dans leur établissement,https://www.parlament.ch/fr/ratsbetrieb/amtliches-bulletin/amtliches-bulletin-die-verhandlungen?SubjectId=42400
35,16.3380,Conseil national - 14.12.2017-08:00 - Motion - Béglé Claude,Finance numérique. Coordonner son avènement,https://www.parlament.ch/fr/ratsbetrieb/amtliches-bulletin/amtliches-bulletin-die-verhandlungen?SubjectId=42083
36,16.074,Conseil national - 14.12.2017-08:00 - Objet du Conseil fédéral,Pour une monnaie à l’abri des crises: émission monétaire uniquement par la Banque nationale! (Initiative Monnaie pleine). Initiative populaire,https://www.parlament.ch/fr/ratsbetrieb/amtliches-bulletin/amtliches-bulletin-die-verhandlungen?SubjectId=42068
37,17.3849,Conseil national - 13.12.2017-15:00 - Motion - Béglé Claude,Armée suisse. Comment garantir notre souveraineté et notre indépendance alors que le numérique pousse à l'interdépendance?,https://www.parlament.ch/fr/ratsbetrieb/amtliches-bulletin/amtliches-bulletin-die-verhandlungen?SubjectId=42055
38,16.3065,Conseil national - 11.12.2017-14:30 - Postulat - Béglé Claude,Pour une retraite flexible de 58 ans jusqu'au-delà de 70 ans sans impacts négatifs,https://www.parlament.ch/fr/ratsbetrieb/amtliches-bulletin/amtliches-bulletin-die-verhandlungen?SubjectId=42001
39,17.3508,Conseil national - 07.12.2017-08:00 - Motion - Eder Joachim,Création d'un centre de compétence fédéral pour la cybersécurité,https://www.parlament.ch/fr/ratsbetrieb/amtliches-bulletin/amtliches-bulletin-die-verhandlungen?SubjectId=41813
40,17.023,Conseil national - 05.12.2017-08:00 - Objet du Conseil fédéral,Pour la souveraineté alimentaire. L’agriculture nous concerne toutes et tous. Initiative populaire,https://www.parlament.ch/fr/ratsbetrieb/amtliches-bulletin/amtliches-bulletin-die-verhandlungen?SubjectId=41784
41,17.3362,Conseil national - 27.09.2017-08:15 - Motion - Commission des finances-Conseil national,Fixation du montant du financement de l'aide publique au développement,https://www.parlament.ch/fr/ratsbetrieb/amtliches-bulletin/amtliches-bulletin-die-verhandlungen?SubjectId=41179
42,17.030,Conseil national - 19.09.2017-08:00 - Objet du Conseil fédéral,Sortons de l'impasse! Renonçons à rétablir des contingents d'immigration. Initiative populaire,https://www.parlament.ch/fr/ratsbetrieb/amtliches-bulletin/amtliches-bulletin-die-verhandlungen?SubjectId=40984
43,16.3902,Conseil national - 18.09.2017-14:30 - Motion - Bischof Pirmin,Interdire les contrats léonins des plates-formes de réservation en ligne dont l'hôtellerie fait les frais,https://www.parlament.ch/fr/ratsbetrieb/amtliches-bulletin/amtliches-bulletin-die-verhandlungen?SubjectId=40971
44,16.071,Conseil national - 14.09.2017-08:00 - Objet du Conseil fédéral,Oui à la suppression des redevances radio et télévision (suppression des redevances Billag). Initiative populaire,https://www.parlament.ch/fr/ratsbetrieb/amtliches-bulletin/amtliches-bulletin-die-verhandlungen?SubjectId=40934
45,16.475,Conseil national - 15.06.2017-15:00 - Initiative parlementaire - Müller Walter,Intensification des relations parlementaires avec le Royaume-Uni,https://www.parlament.ch/fr/ratsbetrieb/amtliches-bulletin/amtliches-bulletin-die-verhandlungen?SubjectId=40636
46,16.066,Conseil national - 14.06.2017-08:15 - Objet du Conseil fédéral,FMI. Octroi d'une garantie pour un prêt au fonds fiduciaire,https://www.parlament.ch/fr/ratsbetrieb/amtliches-bulletin/amtliches-bulletin-die-verhandlungen?SubjectId=40543
47,17.3250,Conseil national - 14.06.2017-08:15 - Postulat - Béglé Claude,Financer l'humanitaire par le biais du secteur privé,https://www.parlament.ch/fr/ratsbetrieb/amtliches-bulletin/amtliches-bulletin-die-verhandlungen?SubjectId=40534
48,16.3929,Conseil national - 14.06.2017-08:15 - Postulat - Béglé Claude,Bons offices. Faire un bilan des démarches de facilitation et de médiation de la Suisse au niveau international,https://www.parlament.ch/fr/ratsbetrieb/amtliches-bulletin/amtliches-bulletin-die-verhandlungen?SubjectId=40522
49,17.3270,Conseil national - 12.06.2017-14:30 - Motion;Postulat - Commission des institutions politiques-Conseil national,Remplacer le statut des étrangers admis à titre provisoire,https://www.parlament.ch/fr/ratsbetrieb/amtliches-bulletin/amtliches-bulletin-die-verhandlungen?SubjectId=40451
50,17.5263,Conseil national - 06.06.2017-14:30 - Heure des questions. Question - Béglé Claude,Les praticiens étrangers installés en Suisse parlent-ils bien notre langue?,https://www.parlament.ch/fr/ratsbetrieb/amtliches-bulletin/amtliches-bulletin-die-verhandlungen?SubjectId=40283
51,16.3385,Conseil national - 30.05.2017-08:00 - Postulat - Béglé Claude,Mieux valoriser nos barrages en vendant une assurance contre le black-out électrique,https://www.parlament.ch/fr/ratsbetrieb/amtliches-bulletin/amtliches-bulletin-die-verhandlungen?SubjectId=40184
52,16.3260,Conseil national - 30.05.2017-08:00 - Postulat - Béglé Claude,Mettre en place une gouvernance du numérique,https://www.parlament.ch/fr/ratsbetrieb/amtliches-bulletin/amtliches-bulletin-die-verhandlungen?SubjectId=40177
53,17.3011,Conseil national - 30.05.2017-08:00 - Motion - Commission des transports et des télécommunications-Conseil national,Pour que les acteurs du marché postal suisse bénéficient d'une concurrence équitable,https://www.parlament.ch/fr/ratsbetrieb/amtliches-bulletin/amtliches-bulletin-die-verhandlungen?SubjectId=40174
54,16.3348,Conseil national - 16.03.2017-15:00 - Motion;Postulat - Béglé Claude,Création d'un conseil de cyberdéfense. Une priorité pour notre souveraineté et notre sécurité,https://www.parlament.ch/fr/ratsbetrieb/amtliches-bulletin/amtliches-bulletin-die-verhandlungen?SubjectId=39818
55,17.008,Conseil national - 16.03.2017-08:00 - Objet du Conseil fédéral,Politique économique extérieure 2016. Rapport,https://www.parlament.ch/fr/ratsbetrieb/amtliches-bulletin/amtliches-bulletin-die-verhandlungen?SubjectId=39769
56,16.3888,Conseil national - 15.03.2017-15:00 - Postulat - Béglé Claude,Des parrains pour promouvoir une intégration réussie,https://www.parlament.ch/fr/ratsbetrieb/amtliches-bulletin/amtliches-bulletin-die-verhandlungen?SubjectId=39755
57,16.059,Conseil national - 15.03.2017-08:15 - Objet du Conseil fédéral,Charte européenne de l'autonomie locale. Protocole additionnel,https://www.parlament.ch/fr/ratsbetrieb/amtliches-bulletin/amtliches-bulletin-die-verhandlungen?SubjectId=39738
58,17.5113,Conseil national - 13.03.2017-14:30 - Heure des questions. Question - Béglé Claude,Quel avenir pour le libre-échange?,https://www.parlament.ch/fr/ratsbetrieb/amtliches-bulletin/amtliches-bulletin-die-verhandlungen?SubjectId=39566
59,16.075,Conseil national - 09.03.2017-08:00 - Objet du Conseil fédéral,Organisation de l’infrastructure ferroviaire,https://www.parlament.ch/fr/ratsbetrieb/amtliches-bulletin/amtliches-bulletin-die-verhandlungen?SubjectId=39505
60,16.3744,Conseil national - 08.03.2017-08:00 - Postulat - Béglé Claude,Comment mesurer l'efficacité des contributions de la Suisse aux objectifs de l'Agenda 2030?,https://www.parlament.ch/fr/ratsbetrieb/amtliches-bulletin/amtliches-bulletin-die-verhandlungen?SubjectId=39481
61,16.3541,Conseil national - 08.03.2017-08:00 - Postulat - Béglé Claude,Permettre à la coopération au développement d'exercer pleinement sa mission première,https://www.parlament.ch/fr/ratsbetrieb/amtliches-bulletin/amtliches-bulletin-die-verhandlungen?SubjectId=39480
62,16.3887,Conseil national - 08.03.2017-08:00 - Postulat - Béglé Claude,Soutenir la formation dans les camps de réfugiés,https://www.parlament.ch/fr/ratsbetrieb/amtliches-bulletin/amtliches-bulletin-die-verhandlungen?SubjectId=39478
63,17.009,Conseil national - 08.03.2017-08:00 - Objet du Conseil fédéral,Rapport de politique extérieure 2016,https://www.parlament.ch/fr/ratsbetrieb/amtliches-bulletin/amtliches-bulletin-die-verhandlungen?SubjectId=39473
64,16.083,Conseil national - 02.03.2017-08:00 - Objet du Conseil fédéral,Accord de Paris sur le climat. Approbation,https://www.parlament.ch/fr/ratsbetrieb/amtliches-bulletin/amtliches-bulletin-die-verhandlungen?SubjectId=39315
65,15.057,Conseil national - 13.12.2016-08:00 - Objet du Conseil fédéral,Oui à la protection de la sphère privée. Initiative populaire,https://www.parlament.ch/fr/ratsbetrieb/amtliches-bulletin/amtliches-bulletin-die-verhandlungen?SubjectId=38923
66,16.041,Conseil national - 07.12.2016-08:00 - Objet du Conseil fédéral,Budget 2017 assorti du plan intégré des tâches et des finances 2018-2020,https://www.parlament.ch/fr/ratsbetrieb/amtliches-bulletin/amtliches-bulletin-die-verhandlungen?SubjectId=38806
67,16.056,Conseil national - 06.12.2016-08:00 - Objet du Conseil fédéral,Loi sur le génie génétique. Modification,https://www.parlament.ch/fr/ratsbetrieb/amtliches-bulletin/amtliches-bulletin-die-verhandlungen?SubjectId=38797
68,16.027,Conseil national - 05.12.2016-14:30 - Objet du Conseil fédéral,Loi sur les étrangers. Gestion de I‘immigration et amélioration de la mise en oeuvre des accords sur la libre circulation des personnes,https://www.parlament.ch/fr/ratsbetrieb/amtliches-bulletin/amtliches-bulletin-die-verhandlungen?SubjectId=38710
69,16.058,Conseil national - 05.12.2016-14:30 - Objet du Conseil fédéral,Organisation internationale du Travail. Protocole à la convention no 29 concernant le travail forcé,https://www.parlament.ch/fr/ratsbetrieb/amtliches-bulletin/amtliches-bulletin-die-verhandlungen?SubjectId=38709
70,16.5450,Conseil national - 05.12.2016-14:30 - Heure des questions. Question - Imark Christian,Prestations financières unilatérales du DFAE à des organisations politiques en Colombie,https://www.parlament.ch/fr/ratsbetrieb/amtliches-bulletin/amtliches-bulletin-die-verhandlungen?SubjectId=38695
71,16.037,Conseil national - 27.09.2016-08:00 - Objet du Conseil fédéral,Convention des Nations Unies sur la transparence,https://www.parlament.ch/fr/ratsbetrieb/amtliches-bulletin/amtliches-bulletin-die-verhandlungen?SubjectId=38284
72,15.3688,Conseil national - 13.09.2016-08:00 - Motion - Aebi Andreas,Flux migratoire en mer Méditerranée. Combattre l'origine du problème,https://www.parlament.ch/fr/ratsbetrieb/amtliches-bulletin/amtliches-bulletin-die-verhandlungen?SubjectId=37893
73,15.4163,Conseil national - 13.09.2016-08:00 - Motion - Friedl Claudia,Mise en oeuvre de l'Agenda 2030 de l'ONU. Mesures institutionnelles,https://www.parlament.ch/fr/ratsbetrieb/amtliches-bulletin/amtliches-bulletin-die-verhandlungen?SubjectId=37883
74,16.025,Conseil national - 09.06.2016-08:00 - Objet du Conseil fédéral,"Encouragement de la formation, de la recherche et de l’innovation pendant les années 2017 à 2020",https://www.parlament.ch/fr/ratsbetrieb/amtliches-bulletin/amtliches-bulletin-die-verhandlungen?SubjectId=37385
75,16.023,Conseil national - 08.06.2016-08:00 - Objet du Conseil fédéral,Société interaméricaine d’investissement. Participation de la Suisse à l’augmentation de capital,https://www.parlament.ch/fr/ratsbetrieb/amtliches-bulletin/amtliches-bulletin-die-verhandlungen?SubjectId=37378
76,16.028,Conseil national - 08.06.2016-08:00 - Objet du Conseil fédéral,Accord sur la libre circulation. Extension à la Croatie,https://www.parlament.ch/fr/ratsbetrieb/amtliches-bulletin/amtliches-bulletin-die-verhandlungen?SubjectId=37364
77,16.022,Conseil national - 02.06.2016-08:00 - Objet du Conseil fédéral,Coopération internationale 2017-2020. Continuation,https://www.parlament.ch/fr/ratsbetrieb/amtliches-bulletin/amtliches-bulletin-die-verhandlungen?SubjectId=37268
78,16.028,Conseil national - 26.04.2016-08:00 - Objet du Conseil fédéral,Accord sur la libre circulation. Extension à la Croatie,https://www.parlament.ch/fr/ratsbetrieb/amtliches-bulletin/amtliches-bulletin-die-verhandlungen?SubjectId=37185
79,16.016,Conseil national - 25.04.2016-14:30 - Objet du Conseil fédéral,Programme de la législature 2015-2019,https://www.parlament.ch/fr/ratsbetrieb/amtliches-bulletin/amtliches-bulletin-die-verhandlungen?SubjectId=37180
80,16.9006,Conseil national - 16.03.2016-08:15,"Débat d'actualité.
Situation économique",https://www.parlament.ch/fr/ratsbetrieb/amtliches-bulletin/amtliches-bulletin-die-verhandlungen?SubjectId=36948
81,15.055,Conseil national - 14.03.2016-14:30 - Objet du Conseil fédéral,"40 ans d'adhésion de la Suisse à la CEDH. Bilan et perspectives. Rapport du Conseil fédéral (Po. Stöckli., 13.4187)",https://www.parlament.ch/fr/ratsbetrieb/amtliches-bulletin/amtliches-bulletin-die-verhandlungen?SubjectId=36886
82,15.080,Conseil national - 07.03.2016-14:30 - Objet du Conseil fédéral,Innosuisse. Loi,https://www.parlament.ch/fr/ratsbetrieb/amtliches-bulletin/amtliches-bulletin-die-verhandlungen?SubjectId=36723
83,16.008,Conseil national - 01.03.2016-08:00 - Objet du Conseil fédéral,Politique économique extérieure. Rapport 2015,https://www.parlament.ch/fr/ratsbetrieb/amtliches-bulletin/amtliches-bulletin-die-verhandlungen?SubjectId=36625
84,16.009,Conseil national - 01.03.2016-08:00 - Objet du Conseil fédéral,Rapport de politique extérieure 2015,https://www.parlament.ch/fr/ratsbetrieb/amtliches-bulletin/amtliches-bulletin-die-verhandlungen?SubjectId=36611
85,14.4296,Conseil national - 29.02.2016-14:30 - Postulat - Derder Fathi,"Encourager l'économie participative, l'encadrer et anticiper les défis à venir",https://www.parlament.ch/fr/ratsbetrieb/amtliches-bulletin/amtliches-bulletin-die-verhandlungen?SubjectId=36588
86,14.087,Conseil national - 16.12.2015-08:20 - Objet du Conseil fédéral,AVSplus: pour une AVS forte. Initiative populaire,https://www.parlament.ch/fr/ratsbetrieb/amtliches-bulletin/amtliches-bulletin-die-verhandlungen?SubjectId=36321
87,15.413,Conseil national - 15.12.2015-08:00 - Initiative parlementaire - Regazzi Fabio,Via sicura. Supprimer rapidement les excès et les effets secondaires indésirables associés au délit de chauffard,https://www.parlament.ch/fr/ratsbetrieb/amtliches-bulletin/amtliches-bulletin-die-verhandlungen?SubjectId=36305
88,15.9013,Conseil national - 10.12.2015-08:00,"Session extraordinaire.
Vague de réfugiés en Europe
et contrôles aux frontières",https://www.parlament.ch/fr/ratsbetrieb/amtliches-bulletin/amtliches-bulletin-die-verhandlungen?SubjectId=36196
